<?xml version="1.0" encoding="UTF-8" ?>
<?xml-stylesheet type="text/xsl" href="Marcadores.xsl" ?>
<!--<marcadores xmlns:xsi="http://www.w3.org/2001/XMLSchema-instance"
            xsi:noNamespaceSchemaLocation="Marcadores.xsd">-->
<marcadores autor="Oscar">
    <titulo>Los marcadores de medellin</titulo>
    <pagina ssl="false">
        <nombre>Abrirllave</nombre>
        <descripcion>Tutoriales de informática.</descripcion>
        <url fuente="periodico">http://www.abrirllave.com/</url>
        <año>2000</año>
        <tipo_pagina>educativa</tipo_pagina>
        <correo>oscar@gmail.com</correo>
    </pagina>
    <pagina ssl='false'>
        <nombre>Wikipedia</nombre>
        <descripcion>La enciclopedia libre</descripcion>
        <url fuente="revista">http://www.wikipedia.org/</url>
        <año>2005</año>
        <tipo_pagina>deportiva</tipo_pagina>
    </pagina>
    <pagina ssl="false">
        <nombre>W3C</nombre>
        <descripcion>Word Wide Web Consortium.</descripcion>
        <url fuente="el colombiano">http://www.w3.org/</url>
        <año>2020</año>
    </pagina>
</marcadores>